{
  "system_id": "steward-analysis",
  "task_id": "adb_c40-T3-s3-clean",
  "steps": [
    {
      "step_id": 1,
      "inputs_digest": {
        "batch": "library_qc",
        "sample_size": 12,
        "groups": 2,
        "group_names": ["control", "treated"]
      },
      "method_id": "qc.sample_qc",
      "outputs": {
        "failedSamples": 4,
        "minReplicates": 2,
        "totalSamples": 12,
        "usableSamples": 8,
        "controlUsable": 6,
        "treatedUsable": 2,
        "controlFailed": 0,
        "treatedFailed": 4,
        "minReplicateRequirement": 3,
        "replicateGatePassed": false,
        "minAssignedReads": 5000000,
        "minMappingRate": 0.7,
        "panelGenes": 400,
        "plannedReplicatesPerArm": 6
      },
      "status": "success",
      "decision": "QC fails the minimum-replicate precondition because treated has only 2 usable libraries; re-sequencing is required before gene calling."
    },
    {
      "step_id": 2,
      "inputs_digest": {
        "batch": "sample_sheet",
        "blocked_by": "replicates_sufficient"
      },
      "method_id": "design.identifiability",
      "outputs": {},
      "status": "refused",
      "decision": "The steward would not release the sample sheet because the computed minimum usable-replicate count was 2, below the required 3; design identifiability cannot be computed."
    }
  ],
  "route_decisions": [
    {
      "point": "usable_replicate_gate",
      "chosen_branch": "re-sequence before downstream analysis",
      "observed": {
        "minReplicates": 2,
        "requiredMinReplicates": 3,
        "replicateGatePassed": false
      }
    },
    {
      "point": "sample_sheet_release",
      "chosen_branch": "stop because steward locked the batch",
      "observed": {
        "gate": "replicates_sufficient",
        "minReplicates": 2
      }
    }
  ],
  "turns": 0,
  "interventions": 0,
  "token_cost": null
}
