{
  "system_id": "openai-api-assistant",
  "task_id": "adb_c40-T3-s2-clean",
  "steps": [
    {
      "step_id": 1,
      "inputs_digest": {
        "sampleCount": 12,
        "groupCount": 2,
        "batch": "library_qc"
      },
      "method_id": "qc.sample_qc",
      "outputs": {
        "failedSamples": 0,
        "minReplicates": 6,
        "totalLibraries": 12,
        "controlUsable": 6,
        "treatedUsable": 6,
        "minAssignedReads": 5000000,
        "minMappingRate": 0.7,
        "requiredMinReplicates": 3,
        "passesReplicateRule": true
      },
      "status": "success",
      "decision": "All libraries passed both inclusive QC rules; each arm retained enough usable replicates."
    },
    {
      "step_id": 2,
      "inputs_digest": {
        "sampleCount": 12,
        "groupCount": 2,
        "batch": "sample_sheet"
      },
      "method_id": "design.identifiability",
      "outputs": {
        "confounded": false,
        "batchCount": 2,
        "designRank": 3,
        "designColumns": 3,
        "L1Control": 5,
        "L1Treated": 1,
        "L2Control": 1,
        "L2Treated": 5,
        "bothArmsInEveryBatch": true
      },
      "status": "success",
      "decision": "The intercept+treatment+batch model matrix is full rank, so treatment is estimable separately from batch; batch must remain in the model."
    },
    {
      "step_id": 3,
      "inputs_digest": {
        "sampleCount": 12,
        "geneCount": 400,
        "groupCount": 2,
        "batchCount": 2,
        "batch": "counts"
      },
      "method_id": "expression.de_blocked",
      "outputs": {
        "nSignificant": 38,
        "upSignificant": 15,
        "downSignificant": 23,
        "genesTested": 400,
        "finiteFits": 400,
        "failedFits": 0,
        "normalizationGenes": 397,
        "fallbackCovarianceFits": 3,
        "sizeFactorMin": 0.7897542439141303,
        "sizeFactorMax": 1.242142681753157,
        "padjThreshold": 0.05,
        "log2fcThreshold": 1.0
      },
      "status": "success",
      "decision": "Median-ratio-normalized NB2 models with treatment and preparation batch terms, treatment Wald tests, and panel-wide Benjamini-Hochberg adjustment called: G0026, G0318, G0358, G0247, G0236, G0355, G0228, G0010, G0302, G0183, G0012, G0213, G0141, G0078, G0373, G0163, G0146, G0086, G0372, G0112, G0075, G0342, G0133, G0017, G0291, G0345, G0311, G0283, G0388, G0108, G0295, G0253, G0275, G0081, G0049, G0340, G0351, G0397"
    }
  ],
  "route_decisions": [
    {
      "point": "library_qc_gate",
      "chosen_branch": "proceed_to_design",
      "observed": {
        "failedSamples": 0,
        "minReplicates": 6,
        "requiredMinReplicates": 3
      }
    },
    {
      "point": "design_gate",
      "chosen_branch": "batch_adjusted_differential_expression",
      "observed": {
        "confounded": false,
        "batchCount": 2,
        "designRank": 3,
        "designColumns": 3
      }
    }
  ],
  "turns": 0,
  "interventions": 0,
  "token_cost": null
}