{
  "system_id": "openai-api-assistant",
  "task_id": "adb_c40-T3-s1-clean",
  "steps": [
    {
      "step_id": 1,
      "inputs_digest": {
        "batch": "library_qc",
        "libraries": 12,
        "groups": 2
      },
      "method_id": "qc.sample_qc",
      "outputs": {
        "failedSamples": 0,
        "minReplicates": 6,
        "usableControl": 6,
        "usableTreated": 6,
        "totalLibraries": 12,
        "minAssignedReadsApplied": 5000000,
        "minMappingRateApplied": 0.7,
        "requiredMinReplicates": 3,
        "qcPass": true
      },
      "status": "success",
      "decision": "All libraries met both usability criteria; each arm retained enough usable replicates."
    },
    {
      "step_id": 2,
      "inputs_digest": {
        "batch": "sample_sheet",
        "usableLibraries": 12,
        "groups": 2
      },
      "method_id": "design.identifiability",
      "outputs": {
        "confounded": true,
        "batchCount": 2,
        "modelMatrixRank": 2,
        "modelMatrixColumns": 3,
        "usableLibraries": 12,
        "controlsInControlBatch": 6,
        "controlsInTreatedBatch": 0,
        "treatedInControlBatch": 0,
        "treatedInTreatedBatch": 6
      },
      "status": "success",
      "decision": "Treatment and preparation batch are perfectly confounded, so the treatment contrast is not separately estimable."
    },
    {
      "step_id": 3,
      "inputs_digest": {
        "requested_batch": "counts",
        "gate": "design_identifiable"
      },
      "method_id": "expression.de_blocked",
      "outputs": {},
      "status": "refused",
      "decision": "Gene-level counts were locked because the computed design was confounded; no differential-expression result or candidate count was computed."
    }
  ],
  "route_decisions": [
    {
      "point": "library_usability_gate",
      "chosen_branch": "proceed_to_design_assessment",
      "observed": {
        "failedSamples": 0,
        "minReplicates": 6,
        "requiredMinReplicates": 3
      }
    },
    {
      "point": "design_identifiability_gate",
      "chosen_branch": "stop_before_differential_expression",
      "observed": {
        "confounded": true,
        "modelMatrixRank": 2,
        "modelMatrixColumns": 3
      }
    },
    {
      "point": "candidate_release_gate",
      "chosen_branch": "withhold_candidate_list",
      "observed": {
        "differentialExpressionComputed": false,
        "validationComputed": false
      }
    }
  ],
  "turns": 0,
  "interventions": 0,
  "token_cost": null
}
