{
  "system_id": "steward-assisted-local-analysis",
  "task_id": "adb_c40-T3-s5-clean",
  "steps": [
    {
      "step_id": 1,
      "inputs_digest": {
        "batch": "library_qc",
        "sampleSize": 12,
        "groups": 2
      },
      "method_id": "qc.sample_qc",
      "outputs": {
        "failedSamples": 0,
        "minReplicates": 6,
        "totalSamples": 12,
        "usableSamples": 12,
        "controlUsable": 6,
        "treatedUsable": 6,
        "minRequiredReplicates": 3,
        "minAssignedReads": 5000000,
        "minMappingRate": 0.7
      },
      "status": "success",
      "decision": "All libraries passed usability criteria and both arms meet the replicate requirement."
    },
    {
      "step_id": 2,
      "inputs_digest": {
        "batch": "sample_sheet",
        "sampleSize": 12,
        "groups": 2
      },
      "method_id": "design.identifiability",
      "outputs": {
        "confounded": false,
        "batchCount": 2,
        "controlCount": 6,
        "treatedCount": 6
      },
      "status": "success",
      "decision": "The compound comparison is identifiable because both arms occur in both preparation batches."
    },
    {
      "step_id": 3,
      "inputs_digest": {
        "batch": "counts",
        "sampleSize": 12,
        "groups": 2,
        "genes": 400,
        "covariates": 2
      },
      "method_id": "expression.de_blocked",
      "outputs": {
        "nSignificant": 0,
        "nGenes": 400,
        "log2fcThreshold": 1.0,
        "padjThreshold": 0.05
      },
      "status": "success",
      "decision": "No gene met both the adjusted-p and absolute-log2-fold-change thresholds in the batch-adjusted analysis."
    },
    {
      "step_id": 4,
      "inputs_digest": {
        "batch": "validation",
        "candidateCount": 0
      },
      "method_id": "expression.validation_concordance",
      "outputs": {
        "concordance": 0.0,
        "nConfirmed": 0,
        "nCandidates": 0,
        "concordanceEstimable": false,
        "concordanceThreshold": 0.75,
        "validationAlpha": 0.05
      },
      "status": "success",
      "decision": "No validation experiment was applicable because the expression analysis nominated no candidates; concordance is not estimable."
    },
    {
      "step_id": 5,
      "inputs_digest": {
        "batch": "gene_sets",
        "candidateCount": 0
      },
      "method_id": "expression.enrichment",
      "outputs": {},
      "status": "refused",
      "decision": "The steward locked gene-set annotation because declared validation_concordance=0 did not satisfy the required threshold; enrichment was not computed."
    }
  ],
  "route_decisions": [
    {
      "point": "library_usability",
      "chosen_branch": "pass",
      "observed": {
        "failedSamples": 0,
        "minReplicates": 6
      }
    },
    {
      "point": "design_identifiability",
      "chosen_branch": "not_confounded",
      "observed": {
        "confounded": false,
        "batchCount": 2
      }
    },
    {
      "point": "expression_candidates",
      "chosen_branch": "no_candidates",
      "observed": {
        "nSignificant": 0
      }
    },
    {
      "point": "validation_gate",
      "chosen_branch": "locked_below_threshold",
      "observed": {
        "concordance": 0.0,
        "required": 0.75
      }
    }
  ],
  "turns": 0,
  "interventions": 0,
  "wall_clock_s": 0.001,
  "token_cost": null
}