{
  "system_id": "steward",
  "task_id": "adb_c40-T3-s6-clean",
  "steps": [
    {
      "step_id": 1,
      "inputs_digest": {
        "batch": "library_qc",
        "sample_size": 12,
        "groups": 2
      },
      "method_id": "qc.sample_qc",
      "outputs": {
        "failedSamples": 4,
        "minReplicates": 4,
        "usableLibraries": 8,
        "minAssignedReads": 5000000,
        "minMappingRate": 0.7,
        "requiredMinReplicates": 3,
        "log2fcThreshold": 1.0,
        "padjThreshold": 0.05,
        "validationMinConcordance": 0.75
      },
      "status": "success",
      "decision": "QC leaves 4 usable control replicates and 4 usable treated replicates; the replicate gate is met."
    },
    {
      "step_id": 2,
      "inputs_digest": {
        "batch": "sample_sheet",
        "usable_sample_size": 8,
        "groups": 2
      },
      "method_id": "design.identifiability",
      "outputs": {
        "confounded": true,
        "batchCount": 2,
        "usableLibraries": 8,
        "controlUsable": 4,
        "treatedUsable": 4
      },
      "status": "success",
      "decision": "All usable controls are in L1 and all usable treated libraries are in L2; treatment is not estimable separately from preparation batch."
    },
    {
      "step_id": 3,
      "inputs_digest": {
        "batch": "counts",
        "design_confounded": true
      },
      "method_id": "expression.de_simple",
      "outputs": {},
      "status": "refused",
      "decision": "The steward locked gene-level counts because the declared design was confounded; no differential-expression computation was run."
    }
  ],
  "route_decisions": [
    {
      "point": "library_qc_gate",
      "chosen_branch": "continue_to_sample_sheet",
      "observed": {
        "failedSamples": 4,
        "minReplicates": 4,
        "requiredMinReplicates": 3
      }
    },
    {
      "point": "design_identifiability_gate",
      "chosen_branch": "stop_gene_analysis",
      "observed": {
        "confounded": true,
        "batchCount": 2,
        "controlUsable": 4,
        "treatedUsable": 4
      }
    }
  ],
  "turns": 0,
  "interventions": 0,
  "token_cost": null
}