{
  "system_id": "openai-api-assistant",
  "task_id": "adb_c40-T3-s5-clean",
  "steps": [
    {
      "step_id": 1,
      "inputs_digest": {
        "batch": "library_qc",
        "libraries": 12,
        "groups": 2
      },
      "method_id": "qc.sample_qc",
      "outputs": {
        "failedSamples": 0,
        "minReplicates": 6,
        "controlUsable": 6,
        "treatedUsable": 6,
        "librariesAssessed": 12,
        "requiredMinReplicates": 3,
        "qcPass": true
      },
      "status": "success",
      "decision": "All libraries met both read-count and mapping-rate rules; both arms retain sufficient replication."
    },
    {
      "step_id": 2,
      "inputs_digest": {
        "batch": "sample_sheet",
        "usableSamples": 12,
        "groups": 2
      },
      "method_id": "design.identifiability",
      "outputs": {
        "confounded": false,
        "batchCount": 2,
        "conditionCount": 2,
        "usableSamples": 12,
        "fullModelColumns": 3,
        "fullModelRank": 3,
        "L1Control": 5,
        "L1Treated": 1,
        "L2Control": 1,
        "L2Treated": 5,
        "contrastEstimable": true
      },
      "status": "success",
      "decision": "Condition is imbalanced across preparation batches but not perfectly confounded; the treatment-plus-batch design matrix is full rank."
    },
    {
      "step_id": 3,
      "inputs_digest": {
        "batch": "counts",
        "genes": 400,
        "samples": 12,
        "groups": 2
      },
      "method_id": "expression.de_blocked",
      "outputs": {
        "nSignificant": 3,
        "genesTested": 400,
        "samples": 12,
        "modelColumns": 3,
        "fitFailures": 1,
        "genesWithFiniteResults": 399,
        "positiveGenesForNormalization": 396,
        "sizeFactorMin": 0.7593,
        "sizeFactorMax": 1.2133,
        "padjThreshold": 0.05,
        "log2fcThreshold": 1.0,
        "nUp": 1,
        "nDown": 2,
        "failedGeneTotalCount": 362,
        "G0037_log2FoldChange": -1.008804447928,
        "G0037_pValue": 0.000446655973608433,
        "G0037_adjustedPValue": 0.0222769666837206,
        "G0241_log2FoldChange": 1.03817013697534,
        "G0241_pValue": 0.000739504933791743,
        "G0241_adjustedPValue": 0.0265936888066177,
        "G0269_log2FoldChange": -1.22572157053131,
        "G0269_pValue": 8.64876748976573e-09,
        "G0269_adjustedPValue": 3.45085822841653e-06
      },
      "status": "success",
      "decision": "Median-ratio-normalized negative-binomial gene-wise models included condition and preparation batch; Benjamini-Hochberg adjustment and both facility thresholds yielded the reported calls. One gene-specific model did not converge to a finite result and that gene was not called."
    }
  ],
  "route_decisions": [
    {
      "point": "replicates_sufficient",
      "chosen_branch": "proceed_to_design",
      "observed": {
        "minReplicates": 6,
        "requiredMinReplicates": 3
      }
    },
    {
      "point": "design_identifiable",
      "chosen_branch": "batch_adjusted_differential_expression",
      "observed": {
        "confounded": false,
        "fullModelRank": 3,
        "fullModelColumns": 3
      }
    },
    {
      "point": "gene_calling",
      "chosen_branch": "apply_both_adjusted_p_and_effect_size_thresholds",
      "observed": {
        "padjThreshold": 0.05,
        "log2fcThreshold": 1.0,
        "nSignificant": 3
      }
    }
  ],
  "turns": 0,
  "interventions": 0,
  "token_cost": null
}